{"status":"ready","service":"resonance-nexus","stage":"deployment","production":true,"authMode":"required","authModeOk":true,"persistenceConfigured":true,"githubAdapterConfigured":true,"missingRequired":[],"ownerActionRequired":false,"contractRevision":"2026-10-03-ready-surface","ownerKeys":[],"agentActionRequired":false,"posture":"ready","timestamp":"2026-10-16T21:01:57.628Z"}
